[
  {
    "id": "assentamento:portomonte",
    "schema_version": "0.1.0",
    "nome": "Portomonte",
    "regiao_id": "regiao:costa-sul",
    "estado": "rascunho-factual",
    "fonte": "ambientacao",
    "tipo_dw": {
      "classificacao": null,
      "estado": "aguarda_curadoria"
    },
    "tags_dw": {
      "prosperidade": null,
      "populacao": null,
      "defesas": null,
      "recursos": [],
      "comercio": [],
      "necessidades": [],
      "juramento": []
    },
    "fatos": {
      "posicao": "Assentamento humano escondido por penhascos na Costa Sul",
      "economia": [
        "comércio costeiro",
        "agricultura possibilitada pela purificação da água do Mar de Sangue"
      ],
      "defesa": "Desconhecida nos materiais revisados",
      "conflitos": [
        "Ameaça regional dos Kuo-Toa e abissais marinhos"
      ]
    },
    "observacao": "Portomonte é grande segundo a lore, mas prosperidade, população e defesas DW não são quantificados. Os novos rótulos Carcaça descrevem fatos, não atribuem bônus automáticos.",
    "lugar_id": "lugar:portomonte",
    "natureza": "assentamento_civil",
    "habitantes": [
      {
        "povo_id": "povo:humanos-costa-sul",
        "relacao": "populacao_local_documentada",
        "status": "documentado",
        "fonte": "ambientacao"
      }
    ],
    "rotulos_carcaca": [
      {
        "id": "rotulo:agua_sangrenta_purificada",
        "status": "documentado",
        "fonte": "ambientacao"
      },
      {
        "id": "rotulo:lavoura_sobre_pedra",
        "status": "documentado",
        "fonte": "ambientacao"
      },
      {
        "id": "rotulo:enclave_dos_penhascos",
        "status": "documentado",
        "fonte": "ambientacao"
      },
      {
        "id": "rotulo:templo_purificador",
        "status": "documentado",
        "fonte": "ambientacao"
      }
    ],
    "ecologia_material": {
      "agua": [
        {
          "descricao": "O templo de Deméter purifica a água do Mar de Sangue",
          "uso": "sustento das lavouras",
          "status": "documentado",
          "fonte": "ambientacao"
        }
      ],
      "alimento": [
        {
          "descricao": "Agricultura praticada inclusive sobre pedra mediante purificação da água",
          "uso": "produção agrícola",
          "status": "documentado",
          "fonte": "ambientacao"
        }
      ],
      "abrigo": [
        {
          "descricao": "Povoação escondida entre os penhascos litorâneos",
          "uso": "moradia e proteção geográfica",
          "status": "documentado",
          "fonte": "ambientacao"
        }
      ],
      "continuidade": {
        "situacao": "nao_documentada",
        "descricao": null,
        "fonte": null
      },
      "materiais": [],
      "residuos": [],
      "dependencias": [
        {
          "descricao": "A lavoura depende da purificação da água do Mar de Sangue",
          "status": "documentado",
          "fonte": "ambientacao"
        }
      ],
      "lacunas": [
        "Água potável e abastecimento doméstico não descritos.",
        "Quantidades de alimento e população não informadas.",
        "Defesas, nascimentos e continuidade demográfica não quantificados."
      ]
    },
    "rotas_e_conflitos": [
      {
        "alvo_assentamento_id": null,
        "alvo_texto": "Outros assentamentos da Costa Sul não nomeados",
        "tipo": "comercio_regional",
        "status": "documentado",
        "fonte": "ambientacao"
      },
      {
        "alvo_assentamento_id": null,
        "alvo_texto": "Ameaças kuo-toa e abissais marinhas à costa em geral",
        "tipo": "risco_regional",
        "status": "documentado",
        "fonte": "ambientacao",
        "nota": "Não comprova um ataque específico a Portomonte."
      }
    ]
  },
  {
    "id": "assentamento:rede-cavernas-kuo-toa-costa-sul",
    "schema_version": "0.1.0",
    "nome": "Redes de cavernas habitadas pelos Kuo-Toa da Costa Sul",
    "regiao_id": "regiao:costa-sul",
    "lugar_id": "lugar:cavernas-kuo-toa",
    "natureza": "rede_de_abrigos",
    "estado": "rascunho-factual",
    "fonte": "ambientacao",
    "tipo_dw": {
      "classificacao": null,
      "estado": "aguarda_curadoria"
    },
    "tags_dw": {
      "prosperidade": null,
      "populacao": null,
      "defesas": null,
      "recursos": [],
      "comercio": [],
      "necessidades": [],
      "juramento": []
    },
    "habitantes": [
      {
        "povo_id": "povo:kuo-toa-costa-sul",
        "relacao": "moradores_documentados",
        "status": "documentado",
        "fonte": "ambientacao"
      }
    ],
    "rotulos_carcaca": [
      {
        "id": "rotulo:habitat_de_cavernas",
        "status": "documentado",
        "fonte": "ambientacao"
      },
      {
        "id": "rotulo:devocao_daegon",
        "status": "documentado",
        "fonte": "ambientacao"
      },
      {
        "id": "rotulo:guerra_liturgica",
        "status": "documentado",
        "fonte": "ambientacao"
      }
    ],
    "ecologia_material": {
      "agua": [
        {
          "descricao": "Cavernas costeiras e assentamentos subaquáticos são ambientes utilizados pelos Kuo-Toa.",
          "uso": "habitat aquático e costeiro; potabilidade não descrita",
          "status": "documentado",
          "fonte": "ambientacao"
        }
      ],
      "alimento": [],
      "abrigo": [
        {
          "descricao": "Habitação em cavernas da costa; a lore menciona também cidades subaquáticas, que não são reunidas numa única cidade inventada.",
          "uso": "moradia",
          "status": "documentado",
          "fonte": "ambientacao"
        }
      ],
      "continuidade": {
        "situacao": "nao_documentada",
        "descricao": null,
        "fonte": null
      },
      "materiais": [],
      "residuos": [],
      "dependencias": [],
      "lacunas": [
        "Não há descrição de dieta, de fonte de alimento ou de reprodução.",
        "Não há quantidade de cavernas, nomes individuais nem população.",
        "Não há informação suficiente para atribuir Prosperidade, População ou Defesas DW."
      ]
    },
    "fatos": {
      "posicao": "Cavernas na Costa Sul do Mar de Sangue, sem endereçamento individual conhecido.",
      "economia": [],
      "defesa": "Não documentada",
      "conflitos": [
        "Captura de pessoas para sacrifício a Daegon por grupos kuo-toa, conforme a lore regional."
      ]
    },
    "rotas_e_conflitos": [
      {
        "alvo_assentamento_id": null,
        "alvo_texto": "Assentamentos costeiros e ilhas, sem vítimas individuais especificadas",
        "tipo": "incursoes_sacrificiais",
        "status": "documentado",
        "fonte": "ambientacao",
        "nota": "Pessoas capturadas são destinadas ao sacrifício, não se infere consumo alimentar."
      },
      {
        "alvo_assentamento_id": null,
        "alvo_texto": "Abissais marinhos associados aos ataques regionais",
        "tipo": "atuacao_conjunta_regional",
        "status": "documentado",
        "fonte": "ambientacao",
        "nota": "A aliança em incursões não transforma kuo-toa em demônios e não prova coabitação."
      }
    ],
    "observacao": "Registro agregado de diversos abrigos, não um assentamento individual fictício. Tags DW de assentamentos devem ser escolhidas somente quando uma comunidade concreta for identificada."
  }
]
