[
  {
    "id": "assentamento:rede-cavernas-kuo-toa-costa-sul",
    "schema_version": "0.1.0",
    "nome": "Redes de cavernas habitadas pelos Kuo-Toa da Costa Sul",
    "regiao_id": "regiao:costa-sul",
    "lugar_id": "lugar:cavernas-kuo-toa",
    "natureza": "rede_de_abrigos",
    "estado": "rascunho-factual",
    "fonte": "ambientacao",
    "tipo_dw": {
      "classificacao": null,
      "estado": "aguarda_curadoria"
    },
    "tags_dw": {
      "prosperidade": null,
      "populacao": null,
      "defesas": null,
      "recursos": [],
      "comercio": [],
      "necessidades": [],
      "juramento": []
    },
    "habitantes": [
      {
        "povo_id": "povo:kuo-toa-costa-sul",
        "relacao": "moradores_documentados",
        "status": "documentado",
        "fonte": "ambientacao"
      }
    ],
    "rotulos_carcaca": [
      {
        "id": "rotulo:habitat_de_cavernas",
        "status": "documentado",
        "fonte": "ambientacao"
      },
      {
        "id": "rotulo:devocao_daegon",
        "status": "documentado",
        "fonte": "ambientacao"
      },
      {
        "id": "rotulo:guerra_liturgica",
        "status": "documentado",
        "fonte": "ambientacao"
      }
    ],
    "ecologia_material": {
      "agua": [
        {
          "descricao": "Cavernas costeiras e assentamentos subaquáticos são ambientes utilizados pelos Kuo-Toa.",
          "uso": "habitat aquático e costeiro; potabilidade não descrita",
          "status": "documentado",
          "fonte": "ambientacao"
        }
      ],
      "alimento": [],
      "abrigo": [
        {
          "descricao": "Habitação em cavernas da costa; a lore menciona também cidades subaquáticas, que não são reunidas numa única cidade inventada.",
          "uso": "moradia",
          "status": "documentado",
          "fonte": "ambientacao"
        }
      ],
      "continuidade": {
        "situacao": "nao_documentada",
        "descricao": null,
        "fonte": null
      },
      "materiais": [],
      "residuos": [],
      "dependencias": [],
      "lacunas": [
        "Não há descrição de dieta, de fonte de alimento ou de reprodução.",
        "Não há quantidade de cavernas, nomes individuais nem população.",
        "Não há informação suficiente para atribuir Prosperidade, População ou Defesas DW."
      ]
    },
    "fatos": {
      "posicao": "Cavernas na Costa Sul do Mar de Sangue, sem endereçamento individual conhecido.",
      "economia": [],
      "defesa": "Não documentada",
      "conflitos": [
        "Captura de pessoas para sacrifício a Daegon por grupos kuo-toa, conforme a lore regional."
      ]
    },
    "rotas_e_conflitos": [
      {
        "alvo_assentamento_id": null,
        "alvo_texto": "Assentamentos costeiros e ilhas, sem vítimas individuais especificadas",
        "tipo": "incursoes_sacrificiais",
        "status": "inferido",
        "fonte": "ambientacao",
        "nota": "A atividade regional é documentada, mas não é possível atribuí-la exclusivamente à rede de cavernas (existem cidades subaquáticas)."
      },
      {
        "alvo_assentamento_id": null,
        "alvo_texto": "Abissais marinhos associados aos ataques regionais",
        "tipo": "atuacao_conjunta_regional",
        "status": "inferido",
        "fonte": "ambientacao",
        "nota": "A atividade regional é documentada, mas não é possível atribuí-la exclusivamente à rede de cavernas (existem cidades subaquáticas)."
      }
    ],
    "observacao": "Registro agregado de diversos abrigos, não um assentamento individual fictício. Tags DW de assentamentos devem ser escolhidas somente quando uma comunidade concreta for identificada."
  }
]
